{
  "schema_version": 3,
  "artifact_id": "art_01a0afa6-3320-7eb6-a53e-99b1314a1431",
  "request_id": "req_01a0afa6-3320-758a-9554-d0d3b561b8c6",
  "tenant_id": "tenant_demo",
  "site_id": "demo",
  "kind": "model_input",
  "content_type": "application/json",
  "capture_status": "complete",
  "fidelity": "semantic",
  "bytes_observed": 717,
  "bytes_saved": 717,
  "classification": "SYNTHETIC",
  "example_only": true,
  "storage": {
    "profile": "fixture_none",
    "locator": "examples/evidence/model_input.json",
    "key_ref": null
  },
  "integrity": {
    "algorithm": "sha256_fixture",
    "digest": "4599bd20ddc4c7e5bd58d5d8f60ca5527abafeb34194d0fce7c12ce39b5470a9"
  },
  "parent_refs": [
    "art_01a0afa6-3320-70f3-8e7c-4761bc393710",
    "art_01a0afa6-3320-76ea-aedf-457ae9c1af51"
  ],
  "expires_at": "2026-09-18T13:55:00Z"
}
